text,favorited,favoriteCount,replyToSN,created,truncated,replyToSID,id,replyToUID,statusSource,screenName,retweetCount,isRetweet,retweeted,longitude,latitude,location,language,profileImageURL,,
"A very interesting read. Unfortunately, so much is true.
https://t.co/ER2BoM765M",FALSE,31666,NA,2016-12-10 14:14:23,FALSE,NA,807589280071684000,NA,"<a href=""http://twitter.com/download/iphone"" rel=""nofollow"">Twitter for iPhone</a>",realDonaldTrump,12470,FALSE,FALSE,NA,NA,"New York, NY",en,http://pbs.twimg.com/profile_images/1980294624/DJT_Headshot_V2_normal.jpg,,
"Reports by @CNN that I will be working on The Apprentice during my Presidency, even part time, are ridiculous &amp; untrue - FAKE NEWS!",FALSE,75620,NA,2016-12-10 14:11:49,FALSE,NA,807588632877998000,NA,"<a href=""http://twitter.com/download/iphone"" rel=""nofollow"">Twitter for iPhone</a>",realDonaldTrump,25460,FALSE,FALSE,NA,NA,"New York, NY",en,http://pbs.twimg.com/profile_images/1980294624/DJT_Headshot_V2_normal.jpg,,
"As a show of support for our Armed Forces, I will be going to The Army-Navy Game today. Looking forward to it, should be fun!",FALSE,107124,NA,2016-12-10 12:38:24,FALSE,NA,807565127021109000,NA,"<a href=""http://twitter.com/download/android"" rel=""nofollow"">Twitter for Android</a>",realDonaldTrump,18839,FALSE,FALSE,NA,NA,"New York, NY",en,http://pbs.twimg.com/profile_images/1980294624/DJT_Headshot_V2_normal.jpg,,
I have NOTHING to do with The Apprentice except for fact that I conceived it with Mark B &amp, have a big stake in it. Will devote ZERO TIME!,FALSE,50025,NA,2016-12-10 11:27:22,FALSE,NA,807547249681166000,NA,"<a href=""http://twitter.com/download/android"" rel=""nofollow"">Twitter for Android</a>",realDonaldTrump,11366,FALSE,FALSE,NA,NA,"New York, NY",en,http://pbs.twimg.com/profile_images/1980294624/DJT_Headshot_V2_normal.jpg,
".@RudyGiuliani, one of the finest people I know and a former GREAT Mayor of N.Y.C., just took himself out of consideration for ""State"".",FALSE,30222,NA,2016-12-10 11:19:24,FALSE,NA,807545243608420000,NA,"<a href=""http://twitter.com/download/android"" rel=""nofollow"">Twitter for Android</a>",realDonaldTrump,7230,FALSE,FALSE,NA,NA,"New York, NY",en,http://pbs.twimg.com/profile_images/1980294624/DJT_Headshot_V2_normal.jpg,,
"Thank you Michigan. We are going to bring back your jobs &amp; together, we will MAKE AMERICA GREAT AGAIN!
Watch:… https://t.co/EyLOo26FqW",FALSE,38243,NA,2016-12-10 03:30:50,TRUE,NA,807427326522884000,NA,"<a href=""http://twitter.com/download/iphone"" rel=""nofollow"">Twitter for iPhone</a>",realDonaldTrump,9177,FALSE,FALSE,NA,NA,"New York, NY",en,http://pbs.twimg.com/profile_images/1980294624/DJT_Headshot_V2_normal.jpg,,
Thank you Louisiana! Get out &amp, vote for John Kennedy tomorrow. Electing Kennedy will help enact our agenda on behal… https://t.co/sHXeyreEZI,FALSE,36432,NA,2016-12-09 22:13:21,TRUE,NA,807347429062443000,NA,"<a href=""http://twitter.com/download/iphone"" rel=""nofollow"">Twitter for iPhone</a>",realDonaldTrump,9080,FALSE,FALSE,NA,NA,"New York, NY",en,http://pbs.twimg.com/profile_images/1980294624/DJT_Headshot_V2_normal.jpg,
"Join me live in Louisiana! Tomorrow, we need you to go to the polls &amp; send John Kennedy to the U.S. Senate. https://t.co/O0jtz0BKeL",FALSE,23009,NA,2016-12-09 19:42:30,FALSE,NA,807309464705630000,NA,"<a href=""http://twitter.com/download/iphone"" rel=""nofollow"">Twitter for iPhone</a>",realDonaldTrump,5370,FALSE,FALSE,NA,NA,"New York, NY",en,http://pbs.twimg.com/profile_images/1980294624/DJT_Headshot_V2_normal.jpg,,
"THANK YOU IOWA!
#ThankYouTour2016 https://t.co/v6EB2OQMeO",FALSE,40705,NA,2016-12-09 03:02:04,FALSE,NA,807057700857188000,NA,"<a href=""http://twitter.com/download/iphone"" rel=""nofollow"">Twitter for iPhone</a>",realDonaldTrump,9429,FALSE,FALSE,NA,NA,"New York, NY",en,http://pbs.twimg.com/profile_images/1980294624/DJT_Headshot_V2_normal.jpg,,
"Join me tomorrow! #MAGA 
10am- Baton Rouge, LA. 
Tickets: https://t.co/rvIQ6Yq45P
7pm- Grand Rapids, MI.
Tickets: https://t.co/2UTwAg5V87",FALSE,21089,NA,2016-12-08 23:12:11,FALSE,NA,806999846674698000,NA,"<a href=""http://twitter.com/download/iphone"" rel=""nofollow"">Twitter for iPhone</a>",realDonaldTrump,5916,FALSE,FALSE,NA,NA,"New York, NY",en,http://pbs.twimg.com/profile_images/1980294624/DJT_Headshot_V2_normal.jpg,,
"On my way to Des Moines, Iowa- will see you soon with @mike_pence. Join us! Tickets: https://t.co/1IuRTVwMSx #ThankYouTour2016",FALSE,21838,NA,2016-12-08 22:55:24,FALSE,NA,806995622117122000,NA,"<a href=""http://twitter.com/download/iphone"" rel=""nofollow"">Twitter for iPhone</a>",realDonaldTrump,4090,FALSE,FALSE,NA,NA,"New York, NY",en,http://pbs.twimg.com/profile_images/1980294624/DJT_Headshot_V2_normal.jpg,,
Today we lost a great pioneer of air and space in John Glenn. He was a hero and inspired generations of future explorers. He will be missed.,FALSE,96044,NA,2016-12-08 21:15:52,FALSE,NA,806970576359326000,NA,"<a href=""http://twitter.com/download/iphone"" rel=""nofollow"">Twitter for iPhone</a>",realDonaldTrump,20350,FALSE,FALSE,NA,NA,"New York, NY",en,http://pbs.twimg.com/profile_images/1980294624/DJT_Headshot_V2_normal.jpg,,
"If United Steelworkers 1999 was any good, they would have kept those jobs in Indiana. Spend more time working-less time talking. Reduce dues",FALSE,57681,NA,2016-12-08 01:56:40,FALSE,NA,806678853305385000,NA,"<a href=""http://twitter.com/download/android"" rel=""nofollow"">Twitter for Android</a>",realDonaldTrump,14164,FALSE,FALSE,NA,NA,"New York, NY",en,http://pbs.twimg.com/profile_images/1980294624/DJT_Headshot_V2_normal.jpg,,
"Chuck Jones, who is President of United Steelworkers 1999, has done a terrible job representing workers. No wonder companies flee country!",FALSE,50229,NA,2016-12-08 00:41:48,FALSE,NA,806660011904615000,NA,"<a href=""http://twitter.com/download/android"" rel=""nofollow"">Twitter for Android</a>",realDonaldTrump,12930,FALSE,FALSE,NA,NA,"New York, NY",en,http://pbs.twimg.com/profile_images/1980294624/DJT_Headshot_V2_normal.jpg,,
"Join me tomorrow in Des Moines, Iowa with Vice President-Elect @mike_pence - at 7:00pm!
#ThankYouTour2016 #MAGA… https://t.co/Geq6sT70IT",FALSE,27206,NA,2016-12-07 19:37:32,TRUE,NA,806583438748815000,NA,"<a href=""http://twitter.com/download/iphone"" rel=""nofollow"">Twitter for iPhone</a>",realDonaldTrump,6327,FALSE,FALSE,NA,NA,"New York, NY",en,http://pbs.twimg.com/profile_images/1980294624/DJT_Headshot_V2_normal.jpg,,
"We pause today to remember the 2,403 American heroes who selflessly gave their lives at Pearl Harbor 75 years ago...
https://t.co/r5eRLR24Q3",FALSE,77710,NA,2016-12-07 18:38:00,FALSE,NA,806568460620857000,NA,"<a href=""http://twitter.com/download/iphone"" rel=""nofollow"">Twitter for iPhone</a>",realDonaldTrump,18746,FALSE,FALSE,NA,NA,"New York, NY",en,http://pbs.twimg.com/profile_images/1980294624/DJT_Headshot_V2_normal.jpg,,
I will be interviewed on the @TODAYshow at 7:30. Enjoy!,FALSE,32346,NA,2016-12-07 12:18:56,FALSE,NA,806473064703726000,NA,"<a href=""http://twitter.com/download/android"" rel=""nofollow"">Twitter for Android</a>",realDonaldTrump,5368,FALSE,FALSE,NA,NA,"New York, NY",en,http://pbs.twimg.com/profile_images/1980294624/DJT_Headshot_V2_normal.jpg,,
"A great night in Fayetteville, North Carolina. Thank you! #ICYMI watch here: https://t.co/ZAuTgxKPpb https://t.co/EF9xRWmciA",FALSE,36314,NA,2016-12-07 03:33:20,FALSE,NA,806340792247796000,NA,"<a href=""http://twitter.com/download/iphone"" rel=""nofollow"">Twitter for iPhone</a>",realDonaldTrump,7695,FALSE,FALSE,NA,NA,"New York, NY",en,http://pbs.twimg.com/profile_images/1980294624/DJT_Headshot_V2_normal.jpg,,
"Departing New York with General James 'Mad Dog' Mattis for tonight's rally in Fayetteville, North Carolina! See you… https://t.co/Z8sgJBWI09",FALSE,70647,NA,2016-12-06 21:17:45,TRUE,NA,806246271405163000,NA,"<a href=""http://twitter.com/download/iphone"" rel=""nofollow"">Twitter for iPhone</a>",realDonaldTrump,14278,FALSE,FALSE,NA,NA,"New York, NY",en,http://pbs.twimg.com/profile_images/1980294624/DJT_Headshot_V2_normal.jpg,,
Masa said he would never do this had we (Trump) not won the election!,FALSE,48915,NA,2016-12-06 19:10:27,FALSE,NA,806214236053668000,NA,"<a href=""http://twitter.com"" rel=""nofollow"">Twitter Web Client</a>",realDonaldTrump,13197,FALSE,FALSE,NA,NA,"New York, NY",en,http://pbs.twimg.com/profile_images/1980294624/DJT_Headshot_V2_normal.jpg,,
"Masa (SoftBank) of Japan has agreed to invest $50 billion in the U.S. toward businesses and 50,000 new jobs....",FALSE,89844,NA,2016-12-06 19:09:49,FALSE,NA,806214078465245000,NA,"<a href=""http://twitter.com"" rel=""nofollow"">Twitter Web Client</a>",realDonaldTrump,29104,FALSE,FALSE,NA,NA,"New York, NY",en,http://pbs.twimg.com/profile_images/1980294624/DJT_Headshot_V2_normal.jpg,,
"Join me tonight in Fayetteville, North Carolina at 7pm! 
#ThankYouTour2016 
Tickets: https://t.co/79AHq3NC0v https://t.co/KoZCE7JeG7",FALSE,26780,NA,2016-12-06 16:45:27,FALSE,NA,806177746397307000,NA,"<a href=""http://twitter.com/download/iphone"" rel=""nofollow"">Twitter for iPhone</a>",realDonaldTrump,6568,FALSE,FALSE,NA,NA,"New York, NY",en,http://pbs.twimg.com/profile_images/1980294624/DJT_Headshot_V2_normal.jpg,,
"Boeing is building a brand new 747 Air Force One for future presidents, but costs are out of control, more than $4 billion. Cancel order!",FALSE,143458,NA,2016-12-06 13:52:35,FALSE,NA,806134244384899000,NA,"<a href=""http://twitter.com/download/android"" rel=""nofollow"">Twitter for Android</a>",realDonaldTrump,43391,FALSE,FALSE,NA,NA,"New York, NY",en,http://pbs.twimg.com/profile_images/1980294624/DJT_Headshot_V2_normal.jpg,,
"#ThankYouTour2016 

12/6- North Carolina
https://t.co/79AHq3NC0v

12/8- Iowa
https://t.co/1IuRTVwMSx

12/9- Michiga… https://t.co/vcQaIJ8qoB",FALSE,27066,NA,2016-12-05 23:06:43,TRUE,NA,805911307270713000,NA,"<a href=""http://twitter.com/download/iphone"" rel=""nofollow"">Twitter for iPhone</a>",realDonaldTrump,8204,FALSE,FALSE,NA,NA,"New York, NY",en,http://pbs.twimg.com/profile_images/1980294624/DJT_Headshot_V2_normal.jpg,,
"If the press would cover me accurately &amp; honorably, I would have far less reason to ""tweet."" Sadly, I don't know if that will ever happen!",FALSE,142439,NA,2016-12-05 16:00:27,FALSE,NA,805804034309427000,NA,"<a href=""http://twitter.com"" rel=""nofollow"">Twitter Web Client</a>",realDonaldTrump,38890,FALSE,FALSE,NA,NA,"New York, NY",en,http://pbs.twimg.com/profile_images/1980294624/DJT_Headshot_V2_normal.jpg,,
I am thrilled to nominate Dr. @RealBenCarson as our next Secretary of the US Dept. of Housing and Urban Development… https://t.co/OJKuDFhP3r,FALSE,106303,NA,2016-12-05 13:53:11,TRUE,NA,805772007220646000,NA,"<a href=""http://twitter.com/download/iphone"" rel=""nofollow"">Twitter for iPhone</a>",realDonaldTrump,26942,FALSE,FALSE,NA,NA,"New York, NY",en,http://pbs.twimg.com/profile_images/1980294624/DJT_Headshot_V2_normal.jpg,,
their country (the U.S. doesn't tax them) or to build a massive military complex in the middle of the South China Sea?  I don't think so!,FALSE,52379,NA,2016-12-04 22:30:22,FALSE,NA,805539770864693000,NA,"<a href=""http://twitter.com/download/android"" rel=""nofollow"">Twitter for Android</a>",realDonaldTrump,14607,FALSE,FALSE,NA,NA,"New York, NY",en,http://pbs.twimg.com/profile_images/1980294624/DJT_Headshot_V2_normal.jpg,,
"Did China ask us if it was OK to devalue their currency (making it hard for our companies to compete), heavily tax our products going into..",FALSE,68043,NA,2016-12-04 22:23:55,FALSE,NA,805538149157970000,NA,"<a href=""http://twitter.com/download/android"" rel=""nofollow"">Twitter for Android</a>",realDonaldTrump,20794,FALSE,FALSE,NA,NA,"New York, NY",en,http://pbs.twimg.com/profile_images/1980294624/DJT_Headshot_V2_normal.jpg,,
".@FoxNews will be re-running ""Objectified: Donald Trump,"" the ratings hit produced by the great Harvey Levin of TMZ, at 8:00 P.M. Enjoy!",FALSE,31552,NA,2016-12-04 21:47:21,FALSE,NA,805528947190616000,NA,"<a href=""http://twitter.com/download/android"" rel=""nofollow"">Twitter for Android</a>",realDonaldTrump,6538,FALSE,FALSE,NA,NA,"New York, NY",en,http://pbs.twimg.com/profile_images/1980294624/DJT_Headshot_V2_normal.jpg,,
The Green Party just dropped its recount suit in Pennsylvania and is losing votes in Wisconsin recount. Just a Stein scam to raise money!,FALSE,96399,NA,2016-12-04 18:58:43,FALSE,NA,805486509914780000,NA,"<a href=""http://twitter.com/download/android"" rel=""nofollow"">Twitter for Android</a>",realDonaldTrump,25865,FALSE,FALSE,NA,NA,"New York, NY",en,http://pbs.twimg.com/profile_images/1980294624/DJT_Headshot_V2_normal.jpg,,
expensive mistake! THE UNITED STATES IS OPEN FOR BUSINESS,FALSE,58757,NA,2016-12-04 12:23:27,FALSE,NA,805387038048612000,NA,"<a href=""http://twitter.com/download/android"" rel=""nofollow"">Twitter for Android</a>",realDonaldTrump,15080,FALSE,FALSE,NA,NA,"New York, NY",en,http://pbs.twimg.com/profile_images/1980294624/DJT_Headshot_V2_normal.jpg,,
"these companies are able to move between all 50 states, with no tax or tariff being charged. Please be forewarned prior to making a very ...",FALSE,42522,NA,2016-12-04 12:21:01,FALSE,NA,805386422807105000,NA,"<a href=""http://twitter.com/download/android"" rel=""nofollow"">Twitter for Android</a>",realDonaldTrump,10419,FALSE,FALSE,NA,NA,"New York, NY",en,http://pbs.twimg.com/profile_images/1980294624/DJT_Headshot_V2_normal.jpg,,
"wanting to sell their product, cars, A.C. units etc., back across the border. This tax will make leaving financially difficult, but.....",FALSE,40787,NA,2016-12-04 12:05:35,FALSE,NA,805382541343654000,NA,"<a href=""http://twitter.com/download/android"" rel=""nofollow"">Twitter for Android</a>",realDonaldTrump,9753,FALSE,FALSE,NA,NA,"New York, NY",en,http://pbs.twimg.com/profile_images/1980294624/DJT_Headshot_V2_normal.jpg,,
"without retribution or consequence, is WRONG! There will be a tax on our soon to be strong border of 35% for these companies ......",FALSE,48902,NA,2016-12-04 11:57:41,FALSE,NA,805380553008681000,NA,"<a href=""http://twitter.com/download/android"" rel=""nofollow"">Twitter for Android</a>",realDonaldTrump,12428,FALSE,FALSE,NA,NA,"New York, NY",en,http://pbs.twimg.com/profile_images/1980294624/DJT_Headshot_V2_normal.jpg,,
"fires its employees, builds a new factory or plant in the other country, and then thinks it will sell its product back into the U.S.  ......",FALSE,46691,NA,2016-12-04 11:49:06,FALSE,NA,805378393537659000,NA,"<a href=""http://twitter.com/download/android"" rel=""nofollow"">Twitter for Android</a>",realDonaldTrump,12125,FALSE,FALSE,NA,NA,"New York, NY",en,http://pbs.twimg.com/profile_images/1980294624/DJT_Headshot_V2_normal.jpg,,
"The U.S. is going to substantialy reduce taxes and regulations on businesses, but any business that leaves our country for another country,",FALSE,53831,NA,2016-12-04 11:41:47,FALSE,NA,805376548882776000,NA,"<a href=""http://twitter.com/download/android"" rel=""nofollow"">Twitter for Android</a>",realDonaldTrump,13830,FALSE,FALSE,NA,NA,"New York, NY",en,http://pbs.twimg.com/profile_images/1980294624/DJT_Headshot_V2_normal.jpg,,
"Just tried watching Saturday Night Live - unwatchable! Totally biased, not funny and the Baldwin impersonation just can't get any worse. Sad",FALSE,116401,NA,2016-12-04 05:13:58,FALSE,NA,805278955150471000,NA,"<a href=""http://twitter.com/download/android"" rel=""nofollow"">Twitter for Android</a>",realDonaldTrump,28363,FALSE,FALSE,NA,NA,"New York, NY",en,http://pbs.twimg.com/profile_images/1980294624/DJT_Headshot_V2_normal.jpg,,
"Our great VPE, @mike_pence, is in Louisiana campaigning for John Kennedy for US Senate. John will be a tremendous help to us in Washington.",FALSE,39583,NA,2016-12-03 19:13:01,FALSE,NA,805127720749384000,NA,"<a href=""http://twitter.com/download/iphone"" rel=""nofollow"">Twitter for iPhone</a>",realDonaldTrump,9287,FALSE,FALSE,NA,NA,"New York, NY",en,http://pbs.twimg.com/profile_images/1980294624/DJT_Headshot_V2_normal.jpg,,
State Treasurer John Kennedy is my choice for US Senator from Louisiana. Early voting today, election next Saturday.,FALSE,39305,NA,2016-12-03 19:09:40,FALSE,NA,805126876779913000,NA,"<a href=""http://twitter.com/download/iphone"" rel=""nofollow"">Twitter for iPhone</a>",realDonaldTrump,9876,FALSE,FALSE,NA,NA,"New York, NY",en,http://pbs.twimg.com/profile_images/1980294624/DJT_Headshot_V2_normal.jpg,
"""@TigerWoods: Can’t wait to get back out there and mix it up with the boys. –TW #heroworldchallenge"" Great to have you back Tiger - Special!",FALSE,38103,NA,2016-12-03 16:37:27,FALSE,NA,805088569765360000,NA,"<a href=""http://twitter.com/download/android"" rel=""nofollow"">Twitter for Android</a>",realDonaldTrump,9424,FALSE,FALSE,NA,NA,"New York, NY",en,http://pbs.twimg.com/profile_images/1980294624/DJT_Headshot_V2_normal.jpg,,
Rexnord of Indiana is moving to Mexico and rather viciously firing all of its 300 workers. This is happening all over our country. No more!,FALSE,64878,NA,2016-12-03 03:06:41,FALSE,NA,804884532671431000,NA,"<a href=""http://twitter.com/download/android"" rel=""nofollow"">Twitter for Android</a>",realDonaldTrump,17601,FALSE,FALSE,NA,NA,"New York, NY",en,http://pbs.twimg.com/profile_images/1980294624/DJT_Headshot_V2_normal.jpg,,
Interesting how the U.S. sells Taiwan billions of dollars of military equipment but I should not accept a congratulatory call.,FALSE,124139,NA,2016-12-03 01:41:30,FALSE,NA,804863098138006000,NA,"<a href=""http://twitter.com/download/android"" rel=""nofollow"">Twitter for Android</a>",realDonaldTrump,39261,FALSE,FALSE,NA,NA,"New York, NY",en,http://pbs.twimg.com/profile_images/1980294624/DJT_Headshot_V2_normal.jpg,,
The President of Taiwan CALLED ME today to wish me congratulations on winning the Presidency. Thank you!,FALSE,112055,NA,2016-12-03 00:44:20,FALSE,NA,804848711599882000,NA,"<a href=""http://twitter.com/download/android"" rel=""nofollow"">Twitter for Android</a>",realDonaldTrump,24973,FALSE,FALSE,NA,NA,"New York, NY",en,http://pbs.twimg.com/profile_images/1980294624/DJT_Headshot_V2_normal.jpg,,
"Thank you Ohio! Together, we made history – and now, the real work begins. America will start winning again!… https://t.co/sVNSNJE7Uf",FALSE,72633,NA,2016-12-02 02:45:18,TRUE,NA,804516764562375000,NA,"<a href=""http://twitter.com/download/iphone"" rel=""nofollow"">Twitter for iPhone</a>",realDonaldTrump,17439,FALSE,FALSE,NA,NA,"New York, NY",en,http://pbs.twimg.com/profile_images/1980294624/DJT_Headshot_V2_normal.jpg,,
"Heading to U.S. Bank Arena in Cincinnati, Ohio for a 7pm rally. 
Join me! Tickets: https://t.co/HiWqZvHv6M",FALSE,31384,NA,2016-12-01 22:52:10,FALSE,NA,804458095569158000,NA,"<a href=""http://twitter.com/download/iphone"" rel=""nofollow"">Twitter for iPhone</a>",realDonaldTrump,5602,FALSE,FALSE,NA,NA,"New York, NY",en,http://pbs.twimg.com/profile_images/1980294624/DJT_Headshot_V2_normal.jpg,,
Getting ready to leave for the Great State of Indiana and meet the hard working and wonderful people of Carrier A.C.,FALSE,57686,NA,2016-12-01 14:38:09,FALSE,NA,804333771021570000,NA,"<a href=""http://twitter.com/download/android"" rel=""nofollow"">Twitter for Android</a>",realDonaldTrump,9927,FALSE,FALSE,NA,NA,"New York, NY",en,http://pbs.twimg.com/profile_images/1980294624/DJT_Headshot_V2_normal.jpg,,
My thoughts and prayers are with those affected by the tragic storms and tornadoes in the Southeastern United States. Stay safe!,FALSE,66192,NA,2016-12-01 14:37:57,FALSE,NA,804333718999540000,NA,"<a href=""http://twitter.com/download/iphone"" rel=""nofollow"">Twitter for iPhone</a>",realDonaldTrump,12181,FALSE,FALSE,NA,NA,"New York, NY",en,http://pbs.twimg.com/profile_images/1980294624/DJT_Headshot_V2_normal.jpg,,
Look forward to going to Indiana tomorrow in order to be with the great workers of Carrier. They will sell many air conditioners!,FALSE,68131,NA,2016-12-01 03:48:35,FALSE,NA,804170300908782000,NA,"<a href=""http://twitter.com/download/android"" rel=""nofollow"">Twitter for Android</a>",realDonaldTrump,12765,FALSE,FALSE,NA,NA,"New York, NY",en,http://pbs.twimg.com/profile_images/1980294624/DJT_Headshot_V2_normal.jpg,,
'Donald Trump is already helping the working class' https://t.co/GTuNcQhLYx,FALSE,52718,NA,2016-11-30 20:00:14,FALSE,NA,804052438546317000,NA,"<a href=""http://twitter.com/download/iphone"" rel=""nofollow"">Twitter for iPhone</a>",realDonaldTrump,14919,FALSE,FALSE,NA,NA,"New York, NY",en,http://pbs.twimg.com/profile_images/1980294624/DJT_Headshot_V2_normal.jpg,,
"'President-elect Donald J. Trump today announced his intent to nominate Steven Mnuchin, Wilbur Ross &amp; Todd Ricketts… https://t.co/cEBxoWsnYp",FALSE,26149,NA,2016-11-30 16:21:26,TRUE,NA,803997374016168000,NA,"<a href=""http://twitter.com/download/iphone"" rel=""nofollow"">Twitter for iPhone</a>",realDonaldTrump,7141,FALSE,FALSE,NA,NA,"New York, NY",en,http://pbs.twimg.com/profile_images/1980294624/DJT_Headshot_V2_normal.jpg,,
"Join me in Cincinnati, Ohio tomorrow evening at 7:00pm. I am grateful for all of your support. THANK YOU!
Tickets:… https://t.co/51Emq7Tffa",FALSE,30643,NA,2016-11-30 15:23:43,TRUE,NA,803982850081100000,NA,"<a href=""http://twitter.com/download/iphone"" rel=""nofollow"">Twitter for iPhone</a>",realDonaldTrump,8072,FALSE,FALSE,NA,NA,"New York, NY",en,http://pbs.twimg.com/profile_images/1980294624/DJT_Headshot_V2_normal.jpg,,
"Hence, legal documents are being crafted which take me completely out of business operations. The Presidency is a far more important task!",FALSE,78257,NA,2016-11-30 11:59:38,FALSE,NA,803931490514075000,NA,"<a href=""http://twitter.com/download/android"" rel=""nofollow"">Twitter for Android</a>",realDonaldTrump,17737,FALSE,FALSE,NA,NA,"New York, NY",en,http://pbs.twimg.com/profile_images/1980294624/DJT_Headshot_V2_normal.jpg,,
"do this under the law, I feel it is visually important, as President,  to in no way have a conflict of interest with my various businesses..",FALSE,51381,NA,2016-11-30 11:54:40,FALSE,NA,803930240661811000,NA,"<a href=""http://twitter.com/download/android"" rel=""nofollow"">Twitter for Android</a>",realDonaldTrump,11383,FALSE,FALSE,NA,NA,"New York, NY",en,http://pbs.twimg.com/profile_images/1980294624/DJT_Headshot_V2_normal.jpg,,
great business in total in order to fully focus on running the country in order to MAKE AMERICA GREAT AGAIN! While I am not mandated to ....,FALSE,45760,NA,2016-11-30 11:44:52,FALSE,NA,803927774784344000,NA,"<a href=""http://twitter.com/download/android"" rel=""nofollow"">Twitter for Android</a>",realDonaldTrump,10781,FALSE,FALSE,NA,NA,"New York, NY",en,http://pbs.twimg.com/profile_images/1980294624/DJT_Headshot_V2_normal.jpg,,
I will be holding a major news conference in New York City with my children on December 15 to discuss the fact that I will be leaving my ...,FALSE,45605,NA,2016-11-30 11:39:45,FALSE,NA,803926488579973000,NA,"<a href=""http://twitter.com/download/android"" rel=""nofollow"">Twitter for Android</a>",realDonaldTrump,11444,FALSE,FALSE,NA,NA,"New York, NY",en,http://pbs.twimg.com/profile_images/1980294624/DJT_Headshot_V2_normal.jpg,,
ISIS is taking credit for the terrible stabbing attack at Ohio State University by a Somali refugee who should not have been in our country.,FALSE,108704,NA,2016-11-30 11:20:01,FALSE,NA,803921522784092000,NA,"<a href=""http://twitter.com/download/android"" rel=""nofollow"">Twitter for Android</a>",realDonaldTrump,34944,FALSE,FALSE,NA,NA,"New York, NY",en,http://pbs.twimg.com/profile_images/1980294624/DJT_Headshot_V2_normal.jpg,,
Big day on Thursday for Indiana and the great workers of that wonderful state.We will keep our companies and jobs in the U.S. Thanks Carrier,FALSE,84427,NA,2016-11-30 03:50:44,FALSE,NA,803808454620095000,NA,"<a href=""http://twitter.com/download/android"" rel=""nofollow"">Twitter for Android</a>",realDonaldTrump,18899,FALSE,FALSE,NA,NA,"New York, NY",en,http://pbs.twimg.com/profile_images/1980294624/DJT_Headshot_V2_normal.jpg,,
I will be going to Indiana on Thursday to make a major announcement concerning Carrier A.C. staying in Indianapolis. Great deal for workers!,FALSE,70871,NA,2016-11-30 03:40:16,FALSE,NA,803805823503925000,NA,"<a href=""http://twitter.com/download/android"" rel=""nofollow"">Twitter for Android</a>",realDonaldTrump,15776,FALSE,FALSE,NA,NA,"New York, NY",en,http://pbs.twimg.com/profile_images/1980294624/DJT_Headshot_V2_normal.jpg,,
"'President-Elect Donald J. Trump Nominates Elaine Chao as Secretary of the Department of Transportation'
https://t.co/5FMGdhAZxB",FALSE,27911,NA,2016-11-29 23:37:40,FALSE,NA,803744769566339000,NA,"<a href=""http://twitter.com/download/iphone"" rel=""nofollow"">Twitter for iPhone</a>",realDonaldTrump,6672,FALSE,FALSE,NA,NA,"New York, NY",en,http://pbs.twimg.com/profile_images/1980294624/DJT_Headshot_V2_normal.jpg,,
"Serious voter fraud in Virginia, New Hampshire and California - so why isn't the media reporting on this? Serious bias - big problem!",FALSE,102774,NA,2016-11-28 00:31:54,FALSE,NA,803033642545115000,NA,"<a href=""http://twitter.com/download/android"" rel=""nofollow"">Twitter for Android</a>",realDonaldTrump,31501,FALSE,FALSE,NA,NA,"New York, NY",en,http://pbs.twimg.com/profile_images/1980294624/DJT_Headshot_V2_normal.jpg,,
states instead of the 15 states that I visited. I would have won even more easily and convincingly (but smaller states are forgotten)!,FALSE,48919,NA,2016-11-27 20:41:32,FALSE,NA,802975667197387000,NA,"<a href=""http://twitter.com/download/android"" rel=""nofollow"">Twitter for Android</a>",realDonaldTrump,10948,FALSE,FALSE,NA,NA,"New York, NY",en,http://pbs.twimg.com/profile_images/1980294624/DJT_Headshot_V2_normal.jpg,,
