text,favorited,favoriteCount,replyToSN,created,truncated,replyToSID,id,replyToUID,statusSource,screenName,retweetCount,isRetweet,retweeted,longitude,latitude,location,language,profileImageURL,,
Monitoring the terrible situation in Florida. Just spoke to Governor Scott. Thoughts and prayers for all. Stay safe!,FALSE,15994,NA,2017-01-06 19:30:09,FALSE,NA,817453219613917000,NA,"<a href=""http://twitter.com"" rel=""nofollow"">Twitter Web Client</a>",realDonaldTrump,5357,FALSE,FALSE,NA,NA,"New York, NY",en,http://pbs.twimg.com/profile_images/1980294624/DJT_Headshot_V2_normal.jpg,,
I am asking the chairs of the House and Senate committees to investigate top secret intelligence shared with NBC prior to me seeing it.,FALSE,39878,NA,2017-01-06 16:51:37,FALSE,NA,817413321058029000,NA,"<a href=""http://twitter.com/download/iphone"" rel=""nofollow"">Twitter for iPhone</a>",realDonaldTrump,12494,FALSE,FALSE,NA,NA,"New York, NY",en,http://pbs.twimg.com/profile_images/1980294624/DJT_Headshot_V2_normal.jpg,,
"Anna Wintour came to my office at Trump Tower to ask me to meet with the editors of Conde Nast &amp; Steven Newhouse, a friend. Will go this AM.",FALSE,21160,NA,2017-01-06 14:18:51,FALSE,NA,817374875962769000,NA,"<a href=""http://twitter.com/download/iphone"" rel=""nofollow"">Twitter for iPhone</a>",realDonaldTrump,4441,FALSE,FALSE,NA,NA,"New York, NY",en,http://pbs.twimg.com/profile_images/1980294624/DJT_Headshot_V2_normal.jpg,,
"being a movie star-and that was season 1 compared to season 14. Now compare him to my season 1. But who cares, he supported Kasich &amp; Hillary",FALSE,27131,NA,2017-01-06 12:42:53,FALSE,NA,817350726800306000,NA,"<a href=""http://twitter.com/download/android"" rel=""nofollow"">Twitter for Android</a>",realDonaldTrump,6490,FALSE,FALSE,NA,NA,"New York, NY",en,http://pbs.twimg.com/profile_images/1980294624/DJT_Headshot_V2_normal.jpg,,
"Wow, the ratings are in and Arnold Schwarzenegger got ""swamped"" (or destroyed) by comparison to the ratings machine, DJT. So much for....",FALSE,25429,NA,2017-01-06 12:34:37,FALSE,NA,817348644647109000,NA,"<a href=""http://twitter.com/download/android"" rel=""nofollow"">Twitter for Android</a>",realDonaldTrump,6793,FALSE,FALSE,NA,NA,"New York, NY",en,http://pbs.twimg.com/profile_images/1980294624/DJT_Headshot_V2_normal.jpg,,
"Hopefully, all supporters, and those who want to MAKE AMERICA GREAT AGAIN, will go to D.C. on January 20th. It will be a GREAT SHOW!",FALSE,43790,NA,2017-01-06 12:05:01,FALSE,NA,817341196251070000,NA,"<a href=""http://twitter.com/download/android"" rel=""nofollow"">Twitter for Android</a>",realDonaldTrump,10100,FALSE,FALSE,NA,NA,"New York, NY",en,http://pbs.twimg.com/profile_images/1980294624/DJT_Headshot_V2_normal.jpg,,
and knew they were in big trouble - which is why they cancelled their big fireworks at the last minute.THEY SAW A MOVEMENT LIKE NEVER BEFORE,FALSE,28975,NA,2017-01-06 11:45:47,FALSE,NA,817336355193754000,NA,"<a href=""http://twitter.com/download/android"" rel=""nofollow"">Twitter for Android</a>",realDonaldTrump,6256,FALSE,FALSE,NA,NA,"New York, NY",en,http://pbs.twimg.com/profile_images/1980294624/DJT_Headshot_V2_normal.jpg,,
Hillary and the Dems were never going to beat the PASSION of my voters. They saw what was happening in the last two weeks before the......,FALSE,34959,NA,2017-01-06 11:39:35,FALSE,NA,817334794958807000,NA,"<a href=""http://twitter.com/download/android"" rel=""nofollow"">Twitter for Android</a>",realDonaldTrump,7813,FALSE,FALSE,NA,NA,"New York, NY",en,http://pbs.twimg.com/profile_images/1980294624/DJT_Headshot_V2_normal.jpg,,
"The dishonest media does not report that any money spent on building the Great Wall (for sake of speed), will be paid back by Mexico later!",FALSE,43399,NA,2017-01-06 11:19:49,FALSE,NA,817329823374832000,NA,"<a href=""http://twitter.com/download/android"" rel=""nofollow"">Twitter for Android</a>",realDonaldTrump,13958,FALSE,FALSE,NA,NA,"New York, NY",en,http://pbs.twimg.com/profile_images/1980294624/DJT_Headshot_V2_normal.jpg,,
So how and why are they so sure about hacking if they never even requested an examination of the computer servers? What is going on?,FALSE,60236,NA,2017-01-06 00:40:03,FALSE,NA,817168818539757000,NA,"<a href=""http://twitter.com/download/android"" rel=""nofollow"">Twitter for Android</a>",realDonaldTrump,18573,FALSE,FALSE,NA,NA,"New York, NY",en,http://pbs.twimg.com/profile_images/1980294624/DJT_Headshot_V2_normal.jpg,,
The Democratic National Committee would not allow the FBI to study or see its computer info after it was supposedly hacked by Russia......,FALSE,48497,NA,2017-01-06 00:30:15,FALSE,NA,817166353266262000,NA,"<a href=""http://twitter.com/download/android"" rel=""nofollow"">Twitter for Android</a>",realDonaldTrump,16617,FALSE,FALSE,NA,NA,"New York, NY",en,http://pbs.twimg.com/profile_images/1980294624/DJT_Headshot_V2_normal.jpg,,
"How did NBC get ""an exclusive look into the top secret report he (Obama) was presented?"" Who gave them this report and why? Politics!",FALSE,58030,NA,2017-01-06 00:24:34,FALSE,NA,817164923843281000,NA,"<a href=""http://twitter.com/download/android"" rel=""nofollow"">Twitter for Android</a>",realDonaldTrump,18421,FALSE,FALSE,NA,NA,"New York, NY",en,http://pbs.twimg.com/profile_images/1980294624/DJT_Headshot_V2_normal.jpg,,
"Toyota Motor said will build a new plant in Baja, Mexico, to build Corolla cars for U.S. NO WAY! Build plant in U.S. or pay big border tax.",FALSE,98079,NA,2017-01-05 18:14:30,FALSE,NA,817071792711942000,NA,"<a href=""http://twitter.com/download/android"" rel=""nofollow"">Twitter for Android</a>",realDonaldTrump,30229,FALSE,FALSE,NA,NA,"New York, NY",en,http://pbs.twimg.com/profile_images/1980294624/DJT_Headshot_V2_normal.jpg,,
"to make up their own minds as to the truth. The media lies to make it look like I am against ""Intelligence"" when in fact I am a big fan!",FALSE,62465,NA,2017-01-05 13:45:57,FALSE,NA,817004210529116000,NA,"<a href=""http://twitter.com/download/android"" rel=""nofollow"">Twitter for Android</a>",realDonaldTrump,14627,FALSE,FALSE,NA,NA,"New York, NY",en,http://pbs.twimg.com/profile_images/1980294624/DJT_Headshot_V2_normal.jpg,,
"The dishonest media likes saying that I am in Agreement with Julian Assange - wrong. I simply state what he states, it is for the people....",FALSE,57677,NA,2017-01-05 13:25:30,FALSE,NA,816999062562108000,NA,"<a href=""http://twitter.com/download/android"" rel=""nofollow"">Twitter for Android</a>",realDonaldTrump,15624,FALSE,FALSE,NA,NA,"New York, NY",en,http://pbs.twimg.com/profile_images/1980294624/DJT_Headshot_V2_normal.jpg,,
...time for Republicans &amp, Democrats to get together and come up with a healthcare plan that really works - much less expensive &amp, FAR BETTER!,FALSE,71954,NA,2017-01-05 12:06:42,FALSE,NA,816979231217484000,NA,"<a href=""http://twitter.com/download/android"" rel=""nofollow"">Twitter for Android</a>",realDonaldTrump,15784,FALSE,FALSE,NA,NA,"New York, NY",en,http://pbs.twimg.com/profile_images/1980294624/DJT_Headshot_V2_normal.jpg
"...do the typical political thing and BLAME. The fact is ObamaCare was a lie from the beginning.""Keep you doctor, keep your plan!"" It is....",FALSE,47171,NA,2017-01-05 12:01:33,FALSE,NA,816977937731879000,NA,"<a href=""http://twitter.com/download/android"" rel=""nofollow"">Twitter for Android</a>",realDonaldTrump,11712,FALSE,FALSE,NA,NA,"New York, NY",en,http://pbs.twimg.com/profile_images/1980294624/DJT_Headshot_V2_normal.jpg,,
"The Democrats, lead by head clown Chuck Schumer, know how bad ObamaCare is and what a mess they are in. Instead of working to fix it, they..",FALSE,49182,NA,2017-01-05 11:57:57,FALSE,NA,816977032433271000,NA,"<a href=""http://twitter.com/download/android"" rel=""nofollow"">Twitter for Android</a>",realDonaldTrump,12561,FALSE,FALSE,NA,NA,"New York, NY",en,http://pbs.twimg.com/profile_images/1980294624/DJT_Headshot_V2_normal.jpg,,
"Jackie Evancho's album sales have skyrocketed after announcing her Inauguration performance.Some people just don't understand the ""Movement""",FALSE,76446,NA,2017-01-04 18:52:09,FALSE,NA,816718880731234000,NA,"<a href=""http://twitter.com"" rel=""nofollow"">Twitter Web Client</a>",realDonaldTrump,16767,FALSE,FALSE,NA,NA,"New York, NY",en,http://pbs.twimg.com/profile_images/1980294624/DJT_Headshot_V2_normal.jpg,,
massive increases of ObamaCare will take place this year and Dems are to blame for the mess. It will fall of its own weight - be careful!,FALSE,52545,NA,2017-01-04 14:26:45,FALSE,NA,816652088662958000,NA,"<a href=""http://twitter.com/download/android"" rel=""nofollow"">Twitter for Android</a>",realDonaldTrump,13450,FALSE,FALSE,NA,NA,"New York, NY",en,http://pbs.twimg.com/profile_images/1980294624/DJT_Headshot_V2_normal.jpg,,
"like the 116% hike in Arizona. Also, deductibles are so high that it is practically useless. Don't let the Schumer clowns out of this web...",FALSE,44305,NA,2017-01-04 14:01:53,FALSE,NA,816645831659061000,NA,"<a href=""http://twitter.com/download/android"" rel=""nofollow"">Twitter for Android</a>",realDonaldTrump,11025,FALSE,FALSE,NA,NA,"New York, NY",en,http://pbs.twimg.com/profile_images/1980294624/DJT_Headshot_V2_normal.jpg,,
"Republicans must be careful in that the Dems own the failed ObamaCare disaster, with its poor coverage and massive premium increases......",FALSE,44081,NA,2017-01-04 13:55:53,FALSE,NA,816644321768313000,NA,"<a href=""http://twitter.com/download/android"" rel=""nofollow"">Twitter for Android</a>",realDonaldTrump,10963,FALSE,FALSE,NA,NA,"New York, NY",en,http://pbs.twimg.com/profile_images/1980294624/DJT_Headshot_V2_normal.jpg,,
"things they did and said (like giving the questions to the debate to H). A total double standard! Media, as usual, gave them a pass.",FALSE,44761,NA,2017-01-04 13:31:32,FALSE,NA,816638194468999000,NA,"<a href=""http://twitter.com/download/android"" rel=""nofollow"">Twitter for Android</a>",realDonaldTrump,10647,FALSE,FALSE,NA,NA,"New York, NY",en,http://pbs.twimg.com/profile_images/1980294624/DJT_Headshot_V2_normal.jpg,,
"Somebody hacked the DNC but why did they not have ""hacking defense"" like the RNC has and why have they not responded to the terrible......",FALSE,40699,NA,2017-01-04 13:27:03,FALSE,NA,816637064708030000,NA,"<a href=""http://twitter.com/download/android"" rel=""nofollow"">Twitter for Android</a>",realDonaldTrump,10128,FALSE,FALSE,NA,NA,"New York, NY",en,http://pbs.twimg.com/profile_images/1980294624/DJT_Headshot_V2_normal.jpg,,
Thank you to Ford for scrapping a new plant in Mexico and creating 700 new jobs in the U.S. This is just the beginning - much more to follow,FALSE,84330,NA,2017-01-04 13:19:09,FALSE,NA,816635078067491000,NA,"<a href=""http://twitter.com/download/android"" rel=""nofollow"">Twitter for Android</a>",realDonaldTrump,19470,FALSE,FALSE,NA,NA,"New York, NY",en,http://pbs.twimg.com/profile_images/1980294624/DJT_Headshot_V2_normal.jpg,,
"""@FoxNews: Julian Assange on U.S. media coverage: “It’s very dishonest.” #Hannity https://t.co/ADcPRQifH9"" More dishonest than anyone knows",FALSE,39358,NA,2017-01-04 13:10:05,FALSE,NA,816632793862177000,NA,"<a href=""http://twitter.com/download/android"" rel=""nofollow"">Twitter for Android</a>",realDonaldTrump,14075,FALSE,FALSE,NA,NA,"New York, NY",en,http://pbs.twimg.com/profile_images/1980294624/DJT_Headshot_V2_normal.jpg,,
"Julian Assange said ""a 14 year old could have hacked Podesta"" - why was DNC so careless? Also said Russians did not give him the info!",FALSE,59363,NA,2017-01-04 12:22:38,FALSE,NA,816620855958602000,NA,"<a href=""http://twitter.com/download/android"" rel=""nofollow"">Twitter for Android</a>",realDonaldTrump,18046,FALSE,FALSE,NA,NA,"New York, NY",en,http://pbs.twimg.com/profile_images/1980294624/DJT_Headshot_V2_normal.jpg,,
"The ""Intelligence"" briefing on so-called ""Russian hacking"" was delayed until Friday, perhaps more time needed to build a case. Very strange!",FALSE,79422,NA,2017-01-04 01:14:52,FALSE,NA,816452807024841000,NA,"<a href=""http://twitter.com/download/android"" rel=""nofollow"">Twitter for Android</a>",realDonaldTrump,23770,FALSE,FALSE,NA,NA,"New York, NY",en,http://pbs.twimg.com/profile_images/1980294624/DJT_Headshot_V2_normal.jpg,,
I will be having a general news conference on JANUARY ELEVENTH in N.Y.C. Thank you.,FALSE,57307,NA,2017-01-03 23:58:31,FALSE,NA,816433590892429000,NA,"<a href=""http://twitter.com/download/android"" rel=""nofollow"">Twitter for Android</a>",realDonaldTrump,14601,FALSE,FALSE,NA,NA,"New York, NY",en,http://pbs.twimg.com/profile_images/1980294624/DJT_Headshot_V2_normal.jpg,,
"""Trump is already delivering the jobs he promised America"" https://t.co/11spTMa6Tm",FALSE,51552,NA,2017-01-03 18:44:47,FALSE,NA,816354639859872000,NA,"<a href=""http://twitter.com/download/iphone"" rel=""nofollow"">Twitter for iPhone</a>",realDonaldTrump,13874,FALSE,FALSE,NA,NA,"New York, NY",en,http://pbs.twimg.com/profile_images/1980294624/DJT_Headshot_V2_normal.jpg,,
There should be no further releases from Gitmo. These are extremely dangerous people and should not be allowed back onto the battlefield.,FALSE,81508,NA,2017-01-03 17:20:43,FALSE,NA,816333480409834000,NA,"<a href=""http://twitter.com/download/android"" rel=""nofollow"">Twitter for Android</a>",realDonaldTrump,20500,FALSE,FALSE,NA,NA,"New York, NY",en,http://pbs.twimg.com/profile_images/1980294624/DJT_Headshot_V2_normal.jpg,,
"Instead of driving jobs and wealth away, AMERICA will become the world's great magnet for INNOVATION &amp; JOB CREATION.
https://t.co/siXrptsOrt",FALSE,53160,NA,2017-01-03 17:00:11,FALSE,NA,816328314759606000,NA,"<a href=""http://twitter.com/download/iphone"" rel=""nofollow"">Twitter for iPhone</a>",realDonaldTrump,12532,FALSE,FALSE,NA,NA,"New York, NY",en,http://pbs.twimg.com/profile_images/1980294624/DJT_Headshot_V2_normal.jpg,,
"""@DanScavino: Ford to scrap Mexico plant, invest in Michigan due to Trump policies""
https://t.co/137nUo03Gl",FALSE,51577,NA,2017-01-03 16:44:13,FALSE,NA,816324295781741000,NA,"<a href=""http://twitter.com/download/iphone"" rel=""nofollow"">Twitter for iPhone</a>",realDonaldTrump,15629,FALSE,FALSE,NA,NA,"New York, NY",en,http://pbs.twimg.com/profile_images/1980294624/DJT_Headshot_V2_normal.jpg,,
"........may be, their number one act and priority. Focus on tax reform, healthcare and so many other things of far greater importance! #DTS",FALSE,41905,NA,2017-01-03 15:07:41,FALSE,NA,816300003442495000,NA,"<a href=""http://twitter.com/download/android"" rel=""nofollow"">Twitter for Android</a>",realDonaldTrump,9584,FALSE,FALSE,NA,NA,"New York, NY",en,http://pbs.twimg.com/profile_images/1980294624/DJT_Headshot_V2_normal.jpg,,
"With all that Congress has to work on, do they really have to make the weakening of the Independent Ethics Watchdog, as unfair as it",FALSE,42288,NA,2017-01-03 15:03:29,FALSE,NA,816298944456233000,NA,"<a href=""http://twitter.com/download/android"" rel=""nofollow"">Twitter for Android</a>",realDonaldTrump,10959,FALSE,FALSE,NA,NA,"New York, NY",en,http://pbs.twimg.com/profile_images/1980294624/DJT_Headshot_V2_normal.jpg,,
"The Democrat Governor.of Minnesota said ""The Affordable Care Act (ObamaCare) is no longer affordable!"" - And, it is lousy healthcare.",FALSE,52638,NA,2017-01-03 12:51:15,FALSE,NA,816265668958032000,NA,"<a href=""http://twitter.com/download/android"" rel=""nofollow"">Twitter for Android</a>",realDonaldTrump,12621,FALSE,FALSE,NA,NA,"New York, NY",en,http://pbs.twimg.com/profile_images/1980294624/DJT_Headshot_V2_normal.jpg,,
"People must remember that ObamaCare just doesn't work, and it is not affordable - 116% increases (Arizona). Bill Clinton called it ""CRAZY""",FALSE,58074,NA,2017-01-03 12:46:33,FALSE,NA,816264484629185000,NA,"<a href=""http://twitter.com/download/android"" rel=""nofollow"">Twitter for Android</a>",realDonaldTrump,14517,FALSE,FALSE,NA,NA,"New York, NY",en,http://pbs.twimg.com/profile_images/1980294624/DJT_Headshot_V2_normal.jpg,,
General Motors is sending Mexican made model of Chevy Cruze to U.S. car dealers-tax free across border. Make in U.S.A.or pay big border tax!,FALSE,72038,NA,2017-01-03 12:30:05,FALSE,NA,816260343391515000,NA,"<a href=""http://twitter.com/download/android"" rel=""nofollow"">Twitter for Android</a>",realDonaldTrump,18797,FALSE,FALSE,NA,NA,"New York, NY",en,http://pbs.twimg.com/profile_images/1980294624/DJT_Headshot_V2_normal.jpg,,
"China has been taking out massive amounts of money &amp; wealth from the U.S. in totally one-sided trade, but won't help with North Korea. Nice!",FALSE,64137,NA,2017-01-02 23:47:12,FALSE,NA,816068355555816000,NA,"<a href=""http://twitter.com/download/android"" rel=""nofollow"">Twitter for Android</a>",realDonaldTrump,17668,FALSE,FALSE,NA,NA,"New York, NY",en,http://pbs.twimg.com/profile_images/1980294624/DJT_Headshot_V2_normal.jpg,,
North Korea just stated that it is in the final stages of developing a nuclear weapon capable of reaching parts of the U.S. It won't happen!,FALSE,91720,NA,2017-01-02 23:05:44,FALSE,NA,816057920223846000,NA,"<a href=""http://twitter.com/download/android"" rel=""nofollow"">Twitter for Android</a>",realDonaldTrump,26487,FALSE,FALSE,NA,NA,"New York, NY",en,http://pbs.twimg.com/profile_images/1980294624/DJT_Headshot_V2_normal.jpg,,
"I thought and felt I would win big, easily over the fabled 270 (306). When they cancelled fireworks, they knew, and so did I.",FALSE,62720,NA,2017-01-02 18:44:04,FALSE,NA,815992069412057000,NA,"<a href=""http://twitter.com/download/android"" rel=""nofollow"">Twitter for Android</a>",realDonaldTrump,13631,FALSE,FALSE,NA,NA,"New York, NY",en,http://pbs.twimg.com/profile_images/1980294624/DJT_Headshot_V2_normal.jpg,,
"Various media outlets and pundits say that I thought I was going to lose the election. Wrong, it all came together in the last week and.....",FALSE,46909,NA,2017-01-02 18:37:10,FALSE,NA,815990335318983000,NA,"<a href=""http://twitter.com/download/android"" rel=""nofollow"">Twitter for Android</a>",realDonaldTrump,9117,FALSE,FALSE,NA,NA,"New York, NY",en,http://pbs.twimg.com/profile_images/1980294624/DJT_Headshot_V2_normal.jpg,,
"@CNN just released a book called ""Unprecedented"" which explores the 2016 race &amp; victory. Hope it does well but used worst cover photo of me!",FALSE,13064,CNN,2017-01-02 18:32:29,FALSE,NA,815989154555298000,759251,"<a href=""http://twitter.com/download/android"" rel=""nofollow"">Twitter for Android</a>",realDonaldTrump,3885,FALSE,FALSE,NA,NA,"New York, NY",en,http://pbs.twimg.com/profile_images/1980294624/DJT_Headshot_V2_normal.jpg,,
"Chicago murder rate is record setting - 4,331 shooting victims with 762 murders in 2016. If Mayor can't do it he must ask for Federal help!",FALSE,62967,NA,2017-01-02 17:31:17,FALSE,NA,815973752785793000,NA,"<a href=""http://twitter.com/download/android"" rel=""nofollow"">Twitter for Android</a>",realDonaldTrump,17448,FALSE,FALSE,NA,NA,"New York, NY",en,http://pbs.twimg.com/profile_images/1980294624/DJT_Headshot_V2_normal.jpg,,
"Well, the New Year begins. We will, together, MAKE AMERICA GREAT AGAIN!",FALSE,125467,NA,2017-01-02 14:40:10,FALSE,NA,815930688889352000,NA,"<a href=""http://twitter.com/download/android"" rel=""nofollow"">Twitter for Android</a>",realDonaldTrump,29818,FALSE,FALSE,NA,NA,"New York, NY",en,http://pbs.twimg.com/profile_images/1980294624/DJT_Headshot_V2_normal.jpg,,
"TO ALL AMERICANS-
#HappyNewYear &amp; many blessings to you all! Looking forward to a wonderful &amp; prosperous 2017 as we… https://t.co/1asdMAL4iy",FALSE,125617,NA,2017-01-01 05:00:10,TRUE,NA,815422340540547000,NA,"<a href=""http://twitter.com/download/iphone"" rel=""nofollow"">Twitter for iPhone</a>",realDonaldTrump,33077,FALSE,FALSE,NA,NA,"New York, NY",en,http://pbs.twimg.com/profile_images/1980294624/DJT_Headshot_V2_normal.jpg,,
"Happy Birthday @DonaldJTrumpJr!
https://t.co/uRxyCD3hBz",FALSE,55118,NA,2016-12-31 18:58:12,FALSE,NA,815270850916209000,NA,"<a href=""http://twitter.com/download/iphone"" rel=""nofollow"">Twitter for iPhone</a>",realDonaldTrump,9514,FALSE,FALSE,NA,NA,"New York, NY",en,http://pbs.twimg.com/profile_images/1980294624/DJT_Headshot_V2_normal.jpg,,
"Happy New Year to all, including to my many enemies and those who have fought me and lost so badly they just don't know what to do. Love!",FALSE,350672,NA,2016-12-31 13:17:21,FALSE,NA,815185071317676000,NA,"<a href=""http://twitter.com/download/android"" rel=""nofollow"">Twitter for Android</a>",realDonaldTrump,143536,FALSE,FALSE,NA,NA,"New York, NY",en,http://pbs.twimg.com/profile_images/1980294624/DJT_Headshot_V2_normal.jpg,,
"Russians are playing @CNN and @NBCNews for such fools - funny to watch, they don't have a clue! @FoxNews totally gets it!",FALSE,84244,NA,2016-12-30 22:18:18,FALSE,NA,814958820980040000,NA,"<a href=""http://twitter.com/download/android"" rel=""nofollow"">Twitter for Android</a>",realDonaldTrump,23338,FALSE,FALSE,NA,NA,"New York, NY",en,http://pbs.twimg.com/profile_images/1980294624/DJT_Headshot_V2_normal.jpg,,
"Join @AmerIcan32, founded by Hall of Fame legend @JimBrownNFL32 on 1/19/2017 in Washington, D.C.… https://t.co/9WJZ8iTCQV",FALSE,24351,NA,2016-12-30 19:46:55,TRUE,NA,814920722208297000,NA,"<a href=""http://twitter.com/download/iphone"" rel=""nofollow"">Twitter for iPhone</a>",realDonaldTrump,7061,FALSE,FALSE,NA,NA,"New York, NY",en,http://pbs.twimg.com/profile_images/1980294624/DJT_Headshot_V2_normal.jpg,,
Great move on delay (by V. Putin) - I always knew he was very smart!,FALSE,96780,NA,2016-12-30 19:41:33,FALSE,NA,814919370711462000,NA,"<a href=""http://twitter.com/download/android"" rel=""nofollow"">Twitter for Android</a>",realDonaldTrump,32980,FALSE,FALSE,NA,NA,"New York, NY",en,http://pbs.twimg.com/profile_images/1980294624/DJT_Headshot_V2_normal.jpg,,
My Administration will follow two simple rules: https://t.co/ZWk0j4H8Qy,FALSE,45340,NA,2016-12-29 14:54:21,FALSE,NA,814484710025994000,NA,"<a href=""http://twitter.com/download/iphone"" rel=""nofollow"">Twitter for iPhone</a>",realDonaldTrump,11321,FALSE,FALSE,NA,NA,"New York, NY",en,http://pbs.twimg.com/profile_images/1980294624/DJT_Headshot_V2_normal.jpg,,
'Economists say Trump delivered hope' https://t.co/SjGBgglIuQ,FALSE,51518,NA,2016-12-28 22:06:28,FALSE,NA,814231064847729000,NA,"<a href=""http://twitter.com/download/iphone"" rel=""nofollow"">Twitter for iPhone</a>",realDonaldTrump,13910,FALSE,FALSE,NA,NA,"New York, NY",en,http://pbs.twimg.com/profile_images/1980294624/DJT_Headshot_V2_normal.jpg,,
"not anymore. The beginning of the end was the horrible Iran deal, and now this (U.N.)! Stay strong Israel, January 20th is fast approaching!",FALSE,117815,NA,2016-12-28 14:25:11,FALSE,NA,814114980983427000,NA,"<a href=""http://twitter.com/download/android"" rel=""nofollow"">Twitter for Android</a>",realDonaldTrump,34805,FALSE,FALSE,NA,NA,"New York, NY",en,http://pbs.twimg.com/profile_images/1980294624/DJT_Headshot_V2_normal.jpg,,
"We cannot continue to let Israel be treated with such total disdain and disrespect. They used to have a great friend in the U.S., but.......",FALSE,106482,NA,2016-12-28 14:19:46,FALSE,NA,814113616110752000,NA,"<a href=""http://twitter.com/download/android"" rel=""nofollow"">Twitter for Android</a>",realDonaldTrump,30375,FALSE,FALSE,NA,NA,"New York, NY",en,http://pbs.twimg.com/profile_images/1980294624/DJT_Headshot_V2_normal.jpg,,
Doing my best to disregard the many inflammatory President O statements and roadblocks.Thought it was going to be a smooth transition - NOT!,FALSE,118149,NA,2016-12-28 14:07:13,FALSE,NA,814110460761018000,NA,"<a href=""http://twitter.com/download/android"" rel=""nofollow"">Twitter for Android</a>",realDonaldTrump,31983,FALSE,FALSE,NA,NA,"New York, NY",en,http://pbs.twimg.com/profile_images/1980294624/DJT_Headshot_V2_normal.jpg,,
"The U.S. Consumer Confidence Index for December surged nearly four points to 113.7, THE HIGHEST LEVEL IN MORE THAN 15 YEARS! Thanks Donald!",FALSE,78547,NA,2016-12-28 03:10:07,FALSE,NA,813945096269861000,NA,"<a href=""http://twitter.com/download/android"" rel=""nofollow"">Twitter for Android</a>",realDonaldTrump,19288,FALSE,FALSE,NA,NA,"New York, NY",en,http://pbs.twimg.com/profile_images/1980294624/DJT_Headshot_V2_normal.jpg,,
"President Obama campaigned hard (and personally) in the very important swing states, and lost.The voters wanted to MAKE AMERICA GREAT AGAIN!",FALSE,100121,NA,2016-12-27 21:52:29,FALSE,NA,813865160163099000,NA,"<a href=""http://twitter.com/download/android"" rel=""nofollow"">Twitter for Android</a>",realDonaldTrump,23363,FALSE,FALSE,NA,NA,"New York, NY",en,http://pbs.twimg.com/profile_images/1980294624/DJT_Headshot_V2_normal.jpg,,
"The DJT Foundation, unlike most foundations, never paid fees, rent, salaries or any expenses. 100% of money goes to wonderful charities!",FALSE,67365,NA,2016-12-27 03:06:59,FALSE,NA,813581917215977000,NA,"<a href=""http://twitter.com/download/android"" rel=""nofollow"">Twitter for Android</a>",realDonaldTrump,15266,FALSE,FALSE,NA,NA,"New York, NY",en,http://pbs.twimg.com/profile_images/1980294624/DJT_Headshot_V2_normal.jpg,,
"I gave millions of dollars to DJT Foundation, raised or recieved millions more, ALL of which is given to charity, and media won't report!",FALSE,71528,NA,2016-12-27 02:53:20,FALSE,NA,813578484572451000,NA,"<a href=""http://twitter.com/download/android"" rel=""nofollow"">Twitter for Android</a>",realDonaldTrump,17484,FALSE,FALSE,NA,NA,"New York, NY",en,http://pbs.twimg.com/profile_images/1980294624/DJT_Headshot_V2_normal.jpg,,
The world was gloomy before I won - there was no hope. Now the market is up nearly 10% and Christmas spending is over a trillion dollars!,FALSE,128891,NA,2016-12-26 23:32:28,FALSE,NA,813527932165558000,NA,"<a href=""http://twitter.com/download/iphone"" rel=""nofollow"">Twitter for iPhone</a>",realDonaldTrump,30360,FALSE,FALSE,NA,NA,"New York, NY",en,http://pbs.twimg.com/profile_images/1980294624/DJT_Headshot_V2_normal.jpg,,
